,Unnamed: 0,ind,data,labels
813,812.0,988,We highly recommend the Clarendon Hotel and Suites.,1
814,813.0,989,Just fill out the card with the time slot you wish your breakfast to arrive at your room.,1
815,814.0,990,So if you are wanting a pool I dont suggest booking here.,1
816,815.0,991,"For the best breakfast tun left as you leave the hotel and walk up to where the small bridge crosses the road at Grand Central Station under this bridge straight across from the station you get the most fantastic breakfast, be early it gets very busy.",1
817,816.0,992,Ps Do the circle line boat tour to see the statue of liberty and the new york skyline it is fantastic.,1
818,817.0,993,Ill recommend it to everyone heading to the City.,1
819,818.0,994,PARKING: is $43 plus tax per day; watch out,1
820,819.0,995,I highly recommend this hotel especially for couples.,1
821,820.0,996,There are some cons about this hotel - REMEMBER - if you drive down your parking is NOT FREE,1
822,821.0,997,This is a great hotel if you want to stay somewhere a little different.,1
823,822.0,998,"The manager should have been promoted long ago,-I will never again meet such a Man who was so happy to help and rectify any problems- he was wonderful.",1
824,823.0,999,This hotel is recommended for budget travelers who do not mind to carry on your own luggages to the room and during check out.,1
